{
    "channels": [
        {
            "type": {
                "name": "179"
            },
            "unit": {
                "name": "°C"
            },
            "values": [
                {
                    "additionalData": [
                        {
                            "description": "IR",
                            "name": "valueType"
                        }
                    ],
                    "description": "26,6",
                    "exponent": 1,
                    "timeStamp": "2017-07-26T11:00:08",
                    "value": 26.574432373046875
                }
            ]
        }
    ],
    "device": [
        {
            "name": "testo 805i",
            "serial": "49614179"
        }
    ],
    "properties": [
        {
            "description": "materialEmission",
            "name": "materialEmission",
            "values": [
                {
                    "description": "0,66",
                    "name": "materialEmissionValue",
                    "value": 0.6600000262260437
                }
            ]
        }
    ],
    "schemaVersion": "1.0.2",
    "timeStamp": "2017-07-26T11:00:08",
    "type": {
        "name": "Temperatur (IR)"
    }
}
