{
    "channels": [
        {
            "type": {
                "name": "601"
            },
            "unit": {
                "name": "%RH"
            },
            "values": [
                {
                    "additionalData": [
                        {
                            "description": "Abluft",
                            "name": "airtype"
                        }
                    ],
                    "description": "0,0",
                    "exponent": 1,
                    "timeStamp": "2017-07-26T13:44:29",
                    "value": 0
                }
            ]
        },
        {
            "type": {
                "name": "600"
            },
            "unit": {
                "name": "%RH"
            },
            "values": [
                {
                    "additionalData": [
                        {
                            "description": "Zuluft",
                            "name": "airtype"
                        }
                    ],
                    "description": "16,5",
                    "exponent": 1,
                    "timeStamp": "2017-07-26T13:44:29",
                    "value": 16.543468475341797
                }
            ]
        },
        {
            "type": {
                "name": "601"
            },
            "unit": {
                "name": "°C"
            },
            "values": [
                {
                    "additionalData": [
                        {
                            "description": "Abluft",
                            "name": "airtype"
                        }
                    ],
                    "description": "-20,0",
                    "exponent": 1,
                    "timeStamp": "2017-07-26T13:44:29",
                    "value": -20
                }
            ]
        },
        {
            "type": {
                "name": "600"
            },
            "unit": {
                "name": "°C"
            },
            "values": [
                {
                    "additionalData": [
                        {
                            "description": "Zuluft",
                            "name": "airtype"
                        }
                    ],
                    "description": "-13,3",
                    "exponent": 1,
                    "timeStamp": "2017-07-26T13:44:29",
                    "value": -13.382598876953125
                }
            ]
        },
        {
            "type": {
                "name": ""
            },
            "unit": {
                "name": "cfm"
            },
            "values": [
                {
                    "description": "1.500",
                    "exponent": 0,
                    "timeStamp": "2017-07-26T13:44:29",
                    "value": 1499.999755859375
                }
            ]
        },
        {
            "type": {
                "name": ""
            },
            "unit": {
                "name": "BTU/h"
            },
            "values": [
                {
                    "description": "24.218",
                    "exponent": 0,
                    "timeStamp": "2017-07-26T13:44:29",
                    "value": 24218.0078125
                }
            ]
        }
    ],
    "device": [
        {
            "name": "testo 605i",
            "serial": "14029601"
        },
        {
            "name": "testo 605i",
            "serial": "14029600"
        }
    ],
    "properties": [
    ],
    "schemaVersion": "1.0.2",
    "timeStamp": "2017-07-26T13:44:29",
    "type": {
        "name": "Kühl- / Heizleistung"
    }
}
