{
  "timeStamp" : "2017-07-26T10:13:32",
  "properties" : [

  ],
  "channels" : [
    {
      "type" : {
        "name" : "875"
      },
      "values" : [
        {
          "exponent" : 1,
          "timeStamp" : "2017-07-26T10:12:52",
          "value" : 29.83517456054688,
          "description" : "29,8",
          "additionalData" : [
            {
              "name" : "unittype",
              "description" : "in (indoor unit)"
            }
          ]
        },
        {
          "exponent" : 1,
          "timeStamp" : "2017-07-26T10:13:10",
          "value" : 28.41458129882812,
          "description" : "28,4",
          "additionalData" : [
            {
              "name" : "unittype",
              "description" : "out (indoor unit)"
            }
          ]
        },
        {
          "exponent" : 1,
          "timeStamp" : "2017-07-26T10:13:16",
          "value" : 32.52127075195312,
          "description" : "32,5",
          "additionalData" : [
            {
              "name" : "unittype",
              "description" : "in (outdoor unit)"
            }
          ]
        },
        {
          "exponent" : 1,
          "timeStamp" : "2017-07-26T10:13:31",
          "value" : 34.06491088867188,
          "description" : "34,1",
          "additionalData" : [
            {
              "name" : "unittype",
              "description" : "out (outdoor unit)"
            }
          ]
        }
      ],
      "unit" : {
        "name" : "Â°C"
      }
    }
  ],
  "device" : [
    {
      "name" : "testo 905i",
      "serial" : "49505875"
    }
  ],
  "schemaVersion" : "1.0.2",
  "type" : {
    "name" : "Quadruple Temperature"
  }
}