{
    "channels": [
        {
            "type": {
                "name": "501"
            },
            "unit": {
                "name": "bar"
            },
            "values": [
                {
                    "additionalData": [
                        {
                            "description": "rel",
                            "name": "valueType"
                        }
                    ],
                    "description": "1,43",
                    "exponent": 2,
                    "timeStamp": "2017-07-26T14:08:49",
                    "value": 1.4330124855041504
                }
            ]
        },
        {
            "type": {
                "name": "600"
            },
            "unit": {
                "name": "°C"
            },
            "values": [
                {
                    "description": "19,6",
                    "exponent": 1,
                    "timeStamp": "2017-07-26T14:08:49",
                    "value": 19.562957763671875
                }
            ]
        },
        {
            "type": {
                "name": "600"
            },
            "unit": {
                "name": "%RH"
            },
            "values": [
                {
                    "description": "98,9",
                    "exponent": 1,
                    "timeStamp": "2017-07-26T14:08:49",
                    "value": 98.90737915039062
                }
            ]
        },
        {
            "type": {
                "name": "600"
            },
            "unit": {
                "name": "°C td"
            },
            "values": [
                {
                    "description": "19,4",
                    "exponent": 1,
                    "timeStamp": "2017-07-26T14:08:49",
                    "value": 19.422027587890625
                }
            ]
        },
        {
            "type": {
                "name": "600"
            },
            "unit": {
                "name": "wb °C"
            },
            "values": [
                {
                    "description": "19,5",
                    "exponent": 1,
                    "timeStamp": "2017-07-26T14:08:49",
                    "value": 19.477264404296875
                }
            ]
        },
        {
            "type": {
                "name": "502"
            },
            "unit": {
                "name": "bar"
            },
            "values": [
                {
                    "additionalData": [
                        {
                            "description": "rel",
                            "name": "valueType"
                        }
                    ],
                    "description": "1,25",
                    "exponent": 2,
                    "timeStamp": "2017-07-26T14:08:49",
                    "value": 1.25
                }
            ]
        },
        {
            "type": {
                "name": "601"
            },
            "unit": {
                "name": "°C"
            },
            "values": [
                {
                    "description": "-11,7",
                    "exponent": 1,
                    "timeStamp": "2017-07-26T14:08:49",
                    "value": -11.755706787109375
                }
            ]
        },
        {
            "type": {
                "name": "601"
            },
            "unit": {
                "name": "%RH"
            },
            "values": [
                {
                    "description": "20,6",
                    "exponent": 1,
                    "timeStamp": "2017-07-26T14:08:49",
                    "value": 20.610736846923828
                }
            ]
        },
        {
            "type": {
                "name": "601"
            },
            "unit": {
                "name": "°C td"
            },
            "values": [
                {
                    "description": "-28,1",
                    "exponent": 1,
                    "timeStamp": "2017-07-26T14:08:49",
                    "value": -28.157867431640625
                }
            ]
        },
        {
            "type": {
                "name": "601"
            },
            "unit": {
                "name": "wb °C"
            },
            "values": [
                {
                    "description": "-14,0",
                    "exponent": 1,
                    "timeStamp": "2017-07-26T14:08:49",
                    "value": -14.036407470703125
                }
            ]
        }
    ],
    "device": [
        {
            "name": "testo 605i",
            "serial": "14029600"
        },
        {
            "name": "testo 549i",
            "serial": "13379501"
        },
        {
            "name": "testo 549i",
            "serial": "13379502"
        },
        {
            "name": "testo 605i",
            "serial": "14029601"
        }
    ],
    "properties": [
    ],
    "schemaVersion": "1.0.2",
    "timeStamp": "2017-07-26T14:08:49",
    "type": {
        "name": "Standardansicht"
    }
}
